Author;Title;Year;Citations;Journal;MeSHTerms;volume;operation;index
John Smith;Immunotherapy Resistance Mechanisms in Cell Lung Cancer;2018;60;Cancer research;Cancer, Tumor;1;0;0
Wang Lei;Technologies for Continuous Glucose Monitoring;2019;30;Diabetes Care;Diabetes, Glucose;3;0;0
Maria Lopez;Impact of Environmental Toxins on Neurodevelopment;2023;20;Environmental Health;Air Pollution, Health;5;0;0
Sarah Ross;Advances in Neurosurgical Techniques for Brain Tumors ;2015;90;Neurosurgery;Neuroscience;4;0;0
J Smith;Oncology: Approaches to Treating Pancreatic Cancer;2017;58;Cancer res.;Cancer, Pancreas;1;0;0
Kim Sung;Sleep Disorders in Neurodegenerative Diseases: A Review;2019;110;Sleep Medicine Reviews;Sleep Deprivation;6;0;0
John Smith;Unraveling the Molecular Landscape of Melanoma;2023;10;Cancer research;Cancer, Tumors;1;0;0
W. Lei;Artificial Intelligence Applications in Predicting Diabetes;2020;28;Diabetes Care;Diabetes, Glucose;3;0;0
S. Ross;Recent Developments in Minimally Invasive Neurosurgery;2016;30;Diabetes Care;Diabetes, Glucose;3;1;0
G. Solimando;all you need is Promptman;2024;42;Env. Health;Air, quality;5;1;0
Sarah Ross;Advances in Neurosurgical Techniques for Brain Tumors ;2015;90;Neurosurgery;Neuroscience;4;-1;3
John Smith;Unraveling the Molecular Landscape of Melanoma;2023;10;Cancer research;Cancer, Tumors;1;-1;6
